[
  {
    "family": "solana",
    "id": "mainnet-beta",
    "name": "Solana",
    "dir": "solana",
    "nativeSymbol": "SOL",
    "rpc": ["https://api.mainnet-beta.solana.com"],
    "explorer": "https://solscan.io",
    "dexscreenerId": "solana",
    "caip2": "solana:5eykt4UsFv8P8NJdTREpY1vzqKqZKvdp",
    "ignore": [
      "675kPX9MHTjS2zt1qfr1NYHuzeLXfQM9H24wFSUt1Mp8",
      "CAMMCzo5YL8w4VFF8KVHrK22GGUsp5VTaW7grrKgrWqK",
      "CPMMoo8L3F4NbTegBCKVNunggL7H1ZpdTHKxQB5qKP1C",
      "LBUZKhRxPF3XUpBCjp4YzTKgLccjZhTSDM9YuVaPwxo",
      "cpamdpZCGKUy5JxQXB4dcpGPiikHawvSWAd6mEn1sGG",
      "whirLbMiicVdio4qvUfM5KAg6Ct8VwpYzGff3uctyCc",
      "pAMMBay6oceH9fJKBRHGP5D4bD4sWpmSwMn52FMfXEA"
    ],
    "notes": "ignore = DEX programs whose pool creation mints an LP token (Raydium AMM v4 / CLMM / CPMM, Meteora DLMM / DAMM v2, Orca Whirlpools, PumpSwap); never launchpads."
  },
  {
    "family": "evm",
    "id": 4663,
    "name": "Robinhood Chain",
    "dir": "evm-4663",
    "nativeSymbol": "ETH",
    "rpc": ["https://rpc.mainnet.chain.robinhood.com"],
    "explorer": "https://robinhoodchain.blockscout.com",
    "dexscreenerId": "robinhood",
    "notes": "Arbitrum Orbit L2, ~100 ms blocks, mainnet 2026-07-01. Launchpad identity on Uniswap V4 is the hook address, not tx.to.",
    "ignore": [
      "0x8bceaa40b9acdfaedf85adf4ff01f5ad6517937f",
      "0x89e5db8b5aa49aa85ac63f691524311aeb649eba",
      "0x1f7d7550b1b028f7571e69a784071f0205fd2efa",
      "0xe51960f1b45f1c9fb6d166e6a884f866fc70433b",
      "0x73991a25c818bf1f1128deaab1492d45638de0d3",
      "0x8366a39cc670b4001a1121b8f6a443a643e40951",
      "0x58daec3116aae6d93017baaea7749052e8a04fa7",
      "0xfc2e4da3edb2e18100473339c763705d263d20a9"
    ],
    "caip2": "eip155:4663",
    "quoteTokens": [
      "0x0bd7d308f8e1639fab988df18a8011f41eacad73",
      "0xc6911796042b15d7fa4f6cde69e245ddcd3d9c31"
    ],
    "maxLogRange": 50000
  },
  {
    "family": "evm",
    "id": 1776,
    "name": "Injective EVM",
    "dir": "evm-1776",
    "nativeSymbol": "INJ",
    "rpc": ["https://sentry.evm-rpc.injective.network"],
    "explorer": "https://blockscout.injective.network",
    "dexscreenerId": "injective",
    "caip2": "eip155:1776",
    "quoteTokens": ["0xa00C59fF5a080D2b954d0c75e46E22a0c371235a"],
    "maxLogRange": 10000
  },
  {
    "family": "evm",
    "id": 5042,
    "name": "Arc",
    "dir": "evm-5042",
    "nativeSymbol": "USDC",
    "rpc": ["https://rpc.mainnet.arc.io"],
    "explorer": "https://arcexplorer.org",
    "dexscreenerId": "arc",
    "notes": "Circle Arc L1, mainnet 2026-09-16. USDC is gas and also ERC-20 at 0x3600000000000000000000000000000000000000. Launchpads seen on DexScreener (o1-launchpad, aka.fun) are not registered yet: PRs welcome.",
    "caip2": "eip155:5042",
    "quoteTokens": ["0x3600000000000000000000000000000000000000"]
  }
]
